{
  "schemaVersion": "1",
  "roles": [
    {
      "employer": "Iberia Retail Systems",
      "title": "Delivery Lead",
      "dates_as_written": "March 2021 - Present",
      "dates_missing": false
    },
    {
      "employer": "Porto Software Studio",
      "title": "Project Coordinator",
      "dates_as_written": "June 2018 - February 2021",
      "dates_missing": false
    },
    {
      "employer": "University of Lisbon",
      "title": "BSc Computer Science",
      "dates_as_written": "2017",
      "dates_missing": false
    }
  ],
  "claims": [
    {
      "id": "summary-delivery-lead-retail-software",
      "semantic_key": "delivery-lead-six-years-retail-software",
      "field_key": null,
      "field_value": null,
      "field_label": null,
      "role": "profile",
      "text": "Delivery lead with 6 years in retail software, from store systems to online checkout.",
      "machine_touch": "verbatim",
      "classification": "Partially-Supported",
      "source_quote": "Delivery lead with 6 years in retail software, from store systems to online checkout.",
      "needs_grill": true,
      "grill_hint": "The dated roles run from June 2018 to the present, which is more than 6 years. Online checkout work is not evidenced in any role. Confirm the years and what the checkout experience was."
    },
    {
      "id": "summary-vendor-negotiation-reporting",
      "semantic_key": "known-for-vendor-negotiation-and-status-reporting",
      "field_key": null,
      "field_value": null,
      "field_label": null,
      "role": "profile",
      "text": "Known for calm vendor negotiations and clear status reporting to directors.",
      "machine_touch": "verbatim",
      "classification": "Partially-Supported",
      "source_quote": "Known for calm vendor negotiations and clear status reporting to directors.",
      "needs_grill": true,
      "grill_hint": "Self-description with no outcome behind it. The weekly steering bullet is adjacent. Ask for a negotiation or a reporting example with a result."
    },
    {
      "id": "iberia-pos-replacement",
      "semantic_key": "led-pos-platform-replacement-140-stores",
      "field_key": null,
      "field_value": null,
      "field_label": null,
      "role": "Iberia Retail Systems - Delivery Lead",
      "text": "Led the replacement of the point-of-sale platform across 140 stores, delivered on budget.",
      "machine_touch": "verbatim",
      "classification": "Verified",
      "source_quote": "Led the replacement of the point-of-sale platform across 140 stores, delivered on budget.",
      "needs_grill": true,
      "grill_hint": "Scope is missing: budget size, team size and how long the rollout took."
    },
    {
      "id": "iberia-weekly-steering",
      "semantic_key": "ran-weekly-steering-with-director-and-vendors",
      "field_key": null,
      "field_value": null,
      "field_label": null,
      "role": "Iberia Retail Systems - Delivery Lead",
      "text": "Ran weekly steering with the operations director and two vendors.",
      "machine_touch": "verbatim",
      "classification": "Verified",
      "source_quote": "Ran weekly steering with the operations director and two vendors.",
      "needs_grill": true,
      "grill_hint": "No outcome or metric. What did the steering decide or unblock?"
    },
    {
      "id": "porto-release-coordination",
      "semantic_key": "coordinated-releases-three-agile-squads",
      "field_key": null,
      "field_value": null,
      "field_label": null,
      "role": "Porto Software Studio - Project Coordinator",
      "text": "Coordinated releases for three agile squads on a two-week cadence.",
      "machine_touch": "verbatim",
      "classification": "Verified",
      "source_quote": "Coordinated releases for three agile squads on a two-week cadence.",
      "needs_grill": false,
      "grill_hint": null
    },
    {
      "id": "project-solar-garden-sensor-network",
      "semantic_key": "built-solar-garden-sensor-network-dashboard",
      "field_key": null,
      "field_value": null,
      "field_label": null,
      "role": "profile",
      "text": "Built a solar-powered garden sensor network with a small web dashboard that charts soil moisture for 12 beds.",
      "machine_touch": "verbatim",
      "classification": "Verified",
      "source_quote": "Built a solar-powered garden sensor network with a small web dashboard that charts soil moisture for 12 beds.",
      "needs_grill": false,
      "grill_hint": null
    },
    {
      "id": "project-family-recipe-wiki",
      "semantic_key": "maintain-family-recipe-wiki-300-entries",
      "field_key": null,
      "field_value": null,
      "field_label": null,
      "role": "profile",
      "text": "Maintain a family recipe wiki with 300 entries and a search index built from plain text files.",
      "machine_touch": "verbatim",
      "classification": "Verified",
      "source_quote": "Maintain a family recipe wiki with 300 entries and a search index built from plain text files.",
      "needs_grill": false,
      "grill_hint": null
    },
    {
      "id": "skill-tools",
      "semantic_key": "skills-jira-ms-project-confluence-sql",
      "field_key": null,
      "field_value": null,
      "field_label": null,
      "role": "profile",
      "text": "Jira, MS Project, Confluence, SQL",
      "machine_touch": "verbatim",
      "classification": "Partially-Supported",
      "source_quote": "Jira, MS Project, Confluence, SQL",
      "needs_grill": false,
      "grill_hint": null
    },
    {
      "id": "edu-university-of-lisbon-bsc-computer-science",
      "semantic_key": "education-bsc-computer-science-university-of-lisbon",
      "field_key": null,
      "field_value": null,
      "field_label": null,
      "role": "University of Lisbon - BSc Computer Science",
      "text": "University of Lisbon, BSc Computer Science, 2017",
      "machine_touch": "verbatim",
      "classification": "Verified",
      "source_quote": "University of Lisbon, BSc Computer Science, 2017",
      "needs_grill": false,
      "grill_hint": null
    },
    {
      "id": "lang-portuguese",
      "semantic_key": "language-portuguese-native",
      "field_key": null,
      "field_value": null,
      "field_label": null,
      "role": "profile",
      "text": "Portuguese (native)",
      "machine_touch": "verbatim",
      "classification": "Verified",
      "source_quote": "Portuguese (native)",
      "needs_grill": false,
      "grill_hint": null
    },
    {
      "id": "lang-english",
      "semantic_key": "language-english-fluent",
      "field_key": null,
      "field_value": null,
      "field_label": null,
      "role": "profile",
      "text": "English (fluent)",
      "machine_touch": "verbatim",
      "classification": "Verified",
      "source_quote": "English (fluent)",
      "needs_grill": false,
      "grill_hint": null
    },
    {
      "id": "lang-spanish",
      "semantic_key": "language-spanish-conversational",
      "field_key": null,
      "field_value": null,
      "field_label": null,
      "role": "profile",
      "text": "Spanish (conversational)",
      "machine_touch": "verbatim",
      "classification": "Verified",
      "source_quote": "Spanish (conversational)",
      "needs_grill": false,
      "grill_hint": null
    },
    {
      "id": "additional-nationality-location",
      "semantic_key": "additional-nationality-portuguese-based-in-lisbon",
      "field_key": null,
      "field_value": null,
      "field_label": null,
      "role": "profile",
      "text": "Nationality: Portuguese, based in Lisbon, Portugal",
      "machine_touch": "verbatim",
      "classification": "Verified",
      "source_quote": "Nationality: Portuguese, based in Lisbon, Portugal",
      "needs_grill": false,
      "grill_hint": null
    },
    {
      "id": "additional-driving-licence",
      "semantic_key": "additional-driving-licence-category-b",
      "field_key": null,
      "field_value": null,
      "field_label": null,
      "role": "profile",
      "text": "Driving licence: category B",
      "machine_touch": "verbatim",
      "classification": "Verified",
      "source_quote": "Driving licence: category B",
      "needs_grill": false,
      "grill_hint": null
    }
  ],
  "parser_flags": [
    "ambiguous-segment: summary states 6 years in retail software, but dated roles span June 2018 to present",
    "no-metrics: Iberia Retail Systems - Ran weekly steering with the operations director and two vendors"
  ]
}
