{
  "schemaVersion": "1",
  "roles": [
    {
      "employer": "NileWare",
      "title": "Delivery Manager",
      "dates_as_written": "2020-",
      "dates_missing": false
    },
    {
      "employer": "PyramidNet",
      "title": "IT Support Lead",
      "dates_as_written": "2016-2020",
      "dates_missing": false
    }
  ],
  "claims": [
    {
      "id": "nileware-ran-delivery-two-enterprise-accounts",
      "semantic_key": "delivery-management-two-enterprise-accounts",
      "field_key": null,
      "field_value": null,
      "field_label": null,
      "role": "Delivery Manager, NileWare",
      "text": "Ran delivery for two enterprise accounts",
      "machine_touch": "verbatim",
      "classification": "Verified",
      "source_quote": "Ran delivery for two enterprise accounts",
      "needs_grill": false,
      "grill_hint": null
    },
    {
      "id": "nileware-capacity-planning-five-teams",
      "semantic_key": "capacity-planning-five-teams",
      "field_key": null,
      "field_value": null,
      "field_label": null,
      "role": "Delivery Manager, NileWare",
      "text": "Set up capacity planning across 5 teams",
      "machine_touch": "verbatim",
      "classification": "Verified",
      "source_quote": "Set up capacity planning across 5 teams",
      "needs_grill": false,
      "grill_hint": null
    },
    {
      "id": "pyramidnet-managed-team-of-six",
      "semantic_key": "managed-it-support-team-of-six",
      "field_key": null,
      "field_value": null,
      "field_label": null,
      "role": "IT Support Lead, PyramidNet",
      "text": "Managed a team of 6",
      "machine_touch": "verbatim",
      "classification": "Verified",
      "source_quote": "Managed a team of 6",
      "needs_grill": false,
      "grill_hint": null
    },
    {
      "id": "edu-bsc-computer-science-cairo-university",
      "semantic_key": "bsc-computer-science-cairo-university",
      "field_key": null,
      "field_value": null,
      "field_label": null,
      "role": "profile",
      "text": "BSc Computer Science, Cairo University (2016)",
      "machine_touch": "verbatim",
      "classification": "Verified",
      "source_quote": "BSc Computer Science, Cairo University (2016)",
      "needs_grill": false,
      "grill_hint": null
    },
    {
      "id": "skill-itil-jira-servicenow",
      "semantic_key": "itsm-framework-and-tools-itil-jira-servicenow",
      "field_key": null,
      "field_value": null,
      "field_label": null,
      "role": "profile",
      "text": "ITIL, Jira, ServiceNow",
      "machine_touch": "verbatim",
      "classification": "Partially-Supported",
      "source_quote": "ITIL, Jira, ServiceNow, Arabic (native), English (fluent)",
      "needs_grill": true,
      "grill_hint": "Listed with no level, years or role context. Which of these were used in which job, and is ITIL a certification (which level and year)?"
    },
    {
      "id": "lang-arabic-native",
      "semantic_key": "language-arabic-native",
      "field_key": null,
      "field_value": null,
      "field_label": null,
      "role": "profile",
      "text": "Arabic (native)",
      "machine_touch": "verbatim",
      "classification": "Partially-Supported",
      "source_quote": "Arabic (native)",
      "needs_grill": true,
      "grill_hint": "Self-declared level only; confirm it is stated correctly."
    },
    {
      "id": "lang-english-fluent",
      "semantic_key": "language-english-fluent",
      "field_key": null,
      "field_value": null,
      "field_label": null,
      "role": "profile",
      "text": "English (fluent)",
      "machine_touch": "verbatim",
      "classification": "Partially-Supported",
      "source_quote": "English (fluent)",
      "needs_grill": true,
      "grill_hint": "Self-declared level only; ask for a test score or whether English is a working language at NileWare."
    }
  ],
  "parser_flags": [
    "ambiguous-segment: NileWare 'Delivery Manager' dates written as '2020-' with no end date; the CV does not say whether the role is current",
    "no-metrics: no experience bullet states an outcome (results, savings, timings); scope is given only as counts of accounts, teams and people",
    "uncovered-section: Contact (name, location and email are not claims and were not mined)"
  ]
}
